Double Head Cabbage;;;Double Head Cabbage, Belize District;2010/10/24;The damages were mainly to homes and small buildings in poor conditions. There was also visible loss to livelihood including loss to agriculture, local vegetation and backyard crops (grapefruit and other citrus plants, banana, plantains, coconuts etc). Fences, including barbed wire enclosures were also damaged.;ATMOSPHCONDITION;Hurricane Richard made landfall in the Northern Lagoon area ;DANA Reports, Village Council Reports;I;;The Mennonite Mission House and the H.C. Health Center exper;1;;;;;33;;;;;;;;;
Isabella Bank;;;Isabella Bank, Belize District;2010/10/24;Only one home was destroyed. There was visible loss to livelihood including loss to agriculture, local vegetation and backyard crops (grapefruit and other citrus plants, banana, plantains, coconuts etc).;ATMOSPHCONDITION;Hurricane Richard made landfall in the Northern Lagoon area ;DANA Reports, Village Council Report;I;;;1;;;;1;;4;110;;;1700;3400;;;
Ladyville;;;Met Office PSWGIA, Ladyville;1982/4/4;Pyroclastic flows and surges destroyed nine villages south of the volcano while damaging lahars were also triggered due to heavy rain falling on unconsolidated pyroclastic deposits. Ash fall out over Belize lasted for almost a week, as white, fine ash settled over all exposed objects, forming a layer of volcanic dust some 2 to 3 cm thick in some places.  The volcanic ash fallout in Belize exacerbated repiratory problems of asmatic persons and those with other respiratory diseases.;ERUPTION;El Chichón, also known as El Chichonal, (roughly translated ;"Websites; Newspaper articles";;;Volcanic ash fallout over Belize resulted in minimal losses,;1;;;;;;;;;;;;;;
San Pablo OW;;;San Pablo, Orange Walk District;2008/6/2;Most of the villages along the Rio Hondo, the New River, the Belize River, and their main tributaries were impacted by the floods produced by the rains associated with Tropical Storm Arthur.;ATMOSPHCONDITION;The widespread floods following the passage of Tropical Stor;"NEMO DANA Report; Met Report; NHC Report; Newspaper Articles";;;Agricultural crops damaged or destroyed included: corn, papa;1;;;;3;23;115;;;;189109,01;378218,02;1;1;728,4
Douglas;;;Douglas Village, Orange Walk District;2008/6/2;Most of the villages along the Rio Hondo, the New River, the Belize River, and their main tributaries were impacted by the floods generated from the rains of Tropical Storm Arthur.;ATMOSPHCONDITION;The widespread floods following the passage of Tropical Stor;"NEMO DANA Report; Met Report; NHC Report; Newspaper Articles";;;An estimated 1600 tons of sugar cane (@$50.00 per ton) held ;1;;;;1;25;125;;;125;155109;310218;1;1;728,4
San Luis;;;San Luis Village,Orange Walk District.;2008/6/2;The impact of the flash flood was  economic, social as well as psychological.  Most of the villagers, especially the children suffered from trauma, shock and nightmares during and long after the event.;ATMOSPHCONDITION;The excessive moisture and instability advected across Beliz;NEMO DANA Report, Met Report, NHC Report, Newspaper Articles;;;The village of San Luis suffered losses of household items d;1;;;;;6;30;;;;31871,33;63742,65;1;1;
Spanish Lookout;;;Mike Usher #3 (Oil Well), Spanish Lookout, Cayo District;2009/7/25;According to the DOE official, the fuel spill was minimal and did not cause any signficant negative damage to the environmen. The effects of the impact of this small oil spill was contained within the BNE compound.;HUMANERROR;The entire community of the Spanish Lookout area experienced;Department of the Environemnt;;;Additional cost included the reparation of the damages to th;1;;;;;;;;;;90;180;;;
Gales Point;;;Gales Point Village, Belize District. Impacts of TS Arthur 2;2008/6/2;The impact of the storm had  economic, social as well as psychological effects.  Most of the villagers, especially the children suffered from trauma, shock and nightmares during and long after the event.;ATMOSPHCONDITION;The excessive moisture and instability advected across Beliz;NEMO DANA Report, Met Report, NHC Report, Newspaper Articles;;;Gales Point Village suffered losses of household items and s;1;;;;;80;400;296;;;608000;1216000;1;1;
Hopkins;;;Hopkins Village, Stann Creek District;2008/6/2;The impact of the storm caused economic, social as well as psychological effects on the community.  Most of the villagers, especially the children suffered from trauma, shock and nightmares, during and long after the event.;ATMOSPHCONDITION;The excessive moisture and instability advected across Beliz;NEMO DANA Report, Met Report, NHC Report, Newspaper Articles;;;The village of Hopkins suffered losses of household. There w;1;;;;;15;75;1193;;;114000;228000;2;1;
Orange Walk;;;Orange Walk Town;2007/1/19;Two residential properties were affected by the contamination and the clean up for the event lasted almost an entire day. Belize Natural Energy (BNE) company was instrumental in the clean up efforts.;HUMANERROR;The oil spilled which occured on the 19th January, 2007 was ;DOE Report;;;Other losses included the reparation of the damaged tanker.;1;;;;;2;;;;;85500;42750;;;
Sittee River;;;Sittee River, Stann Creek District;2008/5/9;The flash flood washed away every movable object on its way.  One person from Sittee River died in the flood.  By 4:30 am the flash flood was swamping Sittee River downstream.;ATMOSPHCONDITION;The main cause of this disaster were the torrential downpour;NEMO DANA Report, Met Reports, NHC Report, CRIFF Report, Newspaper articles;;;Losses resulting from the flash floods generated by TS Arthu;1;1;;;;30;150;374;;;228000;456000;1;1;1821085,39
Hope Creek;;;HopeCreek/Melinda Village, Stann Creek District, Belize.;2008/6/2;The flash flood washed away  every movable object on its way. By 4:30 am the flash flood was swamping the Hope Creek, Melinda and Sarawee communities downstream.;ATMOSPHCONDITION;The main cause of this disaster were the torrential downpour;"NEMO DANA Report; Newspaper Reports; NHC Report; Met Report";;;There was damage to crops, powerlines, and infrastructures.;1;;;;15;140;75;238;;;1414250;2828500;2;;
San Pedro Town;;;"San Pedro, Ambergris Caye; Impact of Tropical Storm Chantel";2001/8/20;The Belize Met Service responded to the storm in a timely and effective fashion. In fact, the National Hurricane Centre had high words of praise for the Belize Met Service, for providing them with accurate and hourly radar information.;ATMOSPHCONDITION;Tropical Storm Chantal moved rapidly westward through the Ca;"Met (NMHS) Report; NHC Report";;;Infracture damage included damages  to piers, palapas and be;1;;;;;;;;;7000;;;;;
Orange Walk;;;Orange Walk Town;2001/8/19;The Belize Met Service responded to the storm in a timely and effective fashion. In fact, the National Hurricane Centre had high words of praise for the Belize Met Service, for providing them with accurate and hourly radar information.;ATMOSPHCONDITION;Tropical Storm Chantal moved rapidly westward through the Ca;"Met (NMHS) Report; NHC Report";;;There were  losses of agricultural crops such as sugarcane, ;1;;;;;;;;;;9000000;18000000;;;
Belize City;;;Belize City during the unnamed Hurricane of  Sept. 10th, 193;1931/9/10;The unnamed hurricane of September 10th 1931 made landfall when most Belizeans were celebrating the Battle of St. George's Caye( National Day) and were caught  unaware of the impending danger of a major hurricane about to strick the colony. Also, most Belizeans were of the opinion that the barrier reef would suppress any storm surge on the coast.  Added to this was the lack of knowledge of the hazards associated with hurricanes, and consequently, the citizens were caught unprepared for the onslaught of this disasterous hurricane.;ATMOSPHCONDITION;The first evidence of the existence of Storm No. 0304 was re;"Jesuits Mission Belize; Channel 5 BZ; Belize Music World Website; Newspaper";III;;The dead and the missing were estimated at 3000 while the da;1;2500;;500;;;2500;;;;2500000;5000000;3;1;
Los Tambos;;;Los Tambos Village, Cayo District;2010/10/24;The strong winds associated with Hurricane Richard caused damages to homes in poor conditions. There were also minor damages to the local vegetation and crops.;ATMOSPHCONDITION;Hurricane Richard made landfall in the Northern Lagoon area ;DANA Reports, Village Council Reports;I;;;1;;;;;2;;10;;;;;;;
Mullins River;;;Mullins River, Stann Creek District;2008/6/1;Crop production in the Mullins River and Gales Point Manatee area is concentrated in  citrus, mango and other fruit trees.  DANA preliminary estimated indicated that 60-65% of the agricultural land in the area was inundated during the Tropical Storm Arthur event of May 31-June 2, 2008.;ATMOSPHCONDITION;Damages in the Stann Creek, Belize, and Orange Walk District;NEMO DANA Report, Newspaper Reports;;;Villagers of Mullins River suffered some losses to their cro;1;;;;;16;110;238;;;212600;243200;1;;
Sarawee;;;Sarawee Village, Stann Creek District, Belize;2008/6/2;The impact of the flash flood was  economic, social as well as psychological.  Most of the villagers, especially the children suffered from trauma, shock and nightmares during and long after the event.;ATMOSPHCONDITION;The excessive moisture and instability advected across Beliz;NEMO DANA Report, Met Report, NHC Report, Newspaper Articles;;;The community of Sarawee suffered losses of household items ;1;;;;;22;;138;;;167200;334400;1;1;
Valley Community;;;Valley Community, Stann Creek District;2008/5/29;The flash flood washed away the Richie house near the bridge at Valley Community, taking along every movable object on its way.  Three members of the Richie family perished in the flash flood.  By 4:30 am the flash flood was swamping the Hope Creek, Melinda and Sarawee communities downstream.;ATMOSPHCONDITION;The main cause of this disaster were the torrential downpour;NEMO DANA Report, Met Reports, NHC Report, CRIFF Report, Newspaper articles;;;Losses resulting from the flash floods generated by TS Arthu;1;3;;;2;4;7;20;;;77100;154200;;;
Belize City;;;Paslow Building Fire, downtown Belize City, Belize, Central ;2002/9/29;Th firemen worked all night until the following day to keep the fire under control. All court records kept on the third floor were destroyed, as well as other assets on the lower floors.;BEHAVIOR;It was concluded that the origin of the Paslow Building Fire;Amandala Newspaper;;;The Paslow Building, in downtown Belize City, was a historic;1;;;;;;;;;;500000;1000000;;;
Belize City;;;Monte Carlo Hotel Fire, Hydes Lane, Belize City;1932/4/18;Some 60 families were left homeless, so the colonial authorities and City leaders , together with charitable organizations and Churches had to combine efforts to provide for the fire victims.;BEHAVIOR;The Report does not determine whether the cause of the fire ;Caiger 161, National Studies BISRA St. Johns' College, Newspapers;;;The Fire devoured three business blocks and fifty two of the;1;;;;60;60;300;400;;;50000;100000;;2;
San Pedro Town;;;Two miles south of San Pedro, Ambergris Caye;2001/12/27;Mr. Bradley, the pilot, tried to fly west against the conditions, but the wind carried the caravan down into the water. Luckily the plane landed on its belly, but the caravan seats were ripped out of palce. The pilot's side of the plane took the brunt of the crash, and the authorities say that he received minor cuts and bruises and was shakened.  The anemometer at San Pedro Tropic Air Headquarters was recording winds up to 23 knots at 6:02 pm.;ATMOSPHCONDITION;According to Johnny Grief, president of Tropic Air, when the;Amandala Newspaper Article;;;The thirteen passengers and pilot suffered minor lacerations;1;;14;;;;;;;;750000;1500000;;;
Belize City;;;Romac's Building Fire, Albert & Church Street, Belize City;2008/3/27;With only one fire truck with a ladder that could reach above the fire, the firefighters had a hard time containing the fire and they did not get it under control until around 1:30 a.m. the following morning, some three-and-a-half hours later.;UNKNOWN;To date the authorities have not determine exactly what star;Amandala Newspaper;;;The Romac's Building Fire destroyed four buildings and milli;1;;;;;;;50;;;1100000;2200000;;;
Augustine;;;Dirt Road, Mountain Pine Ridge;1999/4/30;The flight should have landed between 25-30 minutes after departing from the PSWGIA, but after an hour in the air, the couple noted that the pilot seemed uneasy.  They noticed two clear paths that resembled a runway. The pilot had also obeserve the clear paths and decided to land.  The landing was rough.  Upon landing the tip of the plane's left wing hit a pine tree, which caused the plane to make a 360 degree spin. A flap on one of the wings ripped off, hitting the interior of the plane after breaking in through one of the windows. The plane's propeller was ripped off and it flew into the woods. Patricia sustained multiple lacerations to her right fingers and her husband John, was still in a state of shock three days after the incident.;HUMANERROR;A Maya Island Air Cessna,6-seater aircraft on a routine flig;Amandala Newspaper;;;The two passengers and pilot of the Maya Island Air Cessna a;1;;3;;;;;10;;;600000;1200000;;;
Belize City;;;Belize Red Cross Headquarters, # 1 Gabourel Lane, Belize Cit;2010/12/2;The blaze was brought under control shortly after it was detected around 3:30 a.m., as fire fighters gained forcible entry through a window and fought the fire from inside. Three fire tenders were dispatched to the scene after Police called the Fire Service around 3:30 a.m.;BEHAVIOR;The Operations Officer for the national Fire Service, Michae;Amandala Newspaper, Reporter Press, Belize Red Cross;;;Total losses were estimated in the range of Bz$ 300,000.00. ;1;;;;;;;15;;;150000;300000;;;
Dangriga Town;;;Dangriga Town, Stann Creek District;1968/1/3;The early morning conflagration  on New Year's Day,  January 1st, 1968 destroyed six buildings in Stann Creek Town.;SHORTCIRCUIT;The exact cause of the fire was not determined but it was su;Belize Times Newspaper Article;;;This raging fire in Stann Creek Town destroyed a tailor shop;1;;;;;;;28;;;7000;15000;;;
San Ignacio/Santa Elena;;;San Ignacio Town, Cayo District;1972/5/4;This historic fire gutted the central block of downtown San Ignacio, burning down hotels, liquor stores, grocery stores, hardware stores, office buildings and the homes of many families in the area. The losses were estimated in excess of Bz$ 1.5 million.;HUMANERROR;It was concluded that the cause of this tragic blaze may hav;"Octavia Waight Centre publication; Newspaper articles";;;The tragic San Ignacio Fire was first detected in the early ;1;;;;12;15;80;100;;;750000;1500000;;2;
Belize City;;;The Easter Monday Fire on Albert Street, Belize City.;1975/3/31;This fire traumatized residence in downtown Belize City, as it disrupted the quiet Easter Holiday weekend. The Belize Fire Service responded, but was unable to contain the early morning blaze until about mid morning after it had gutted over 30 buildings on the western side of Albert Street beyond Wesley Church.;BEHAVIOR;The cause of this blaze is still debated, however, arson is ;National Studies BISRA St. John's College. Newspaper articles;;;The Easter Monday Fire in 1975 resulted in the destruction o;1;;;;29;;182;200;;;1250000;2500000;2;3;
Belize City;;;New Road - Queen Street Fire, April 1968, Belize City;1968/4/16;Injuries: Kent Faber, a fireman was knocked unconcious by the explosion of a freon tank and had to be rushed to the Belize City hospital.  Mr. Roy Grant, another fireman, was injured on his left arm, when he was hit by a hose.  Social workers were on the job too, finding out ways and means by which they could help fire victims. Teams from the Social Department and the Salvation Army were doing their best up to press time yesterday to reach victims and offer their assistance. Four engines from the Fire Service and one from the Airport Terminal took part in the fire operation.;SHORTCIRCUIT;The fire reportedly started in the Kattan building on New Ro;"National Studies BISRA St John's College; Craig and Musa Catalogue of Major Fires in Belize City, Newspapers";;;Economic losses as a result of 1968 New Road-Queen Street  F;1;;2;;19;75;175;100;;;500000;1000000;;;
Belize City;;;Second Harley Fire, Belize City;1953/10/5;One death was reported from this blaze, but there were no specific reports of the number of houses demolished or the number of families left homeless.;BEHAVIOR;Once  again,arson was suspected as the origin of this devast;"National Studies BISRA St. John's College; Newspapers";;;The Second so-called  Harley Fire which occurred on October ;1;1;;;;;;;;;250000;500000;;;
Belize City;;;Albert Street, Belize City;1950/7/10;Many families became homeless because of this fire.  Hence, the City authorities were once again obligated to provide for the victims.  The observation made by Superintendent William Stevenson in 1856 was no less true in 1950, as it is true today: Houses are built too close together in Belize and the population density in Belize City is enormously too high...;UNKNOWN;Speculations on the cause of this fire ranged from arson to ;"National Studies BISRA St. John's College; Newspapers";;;Over a hundred persons lost their homes and the total losses;1;;;;13;13;105;105;;;57500;115000;;1;
Belize City;;;First of two Harley Fires, Belize City;1944/9/13;The first Harley Fire of 1944 was not the only major fire of 1944.  Earlier that year on May 3rd , the St. Mary's School , Murry Hall, was gutted by fire.;BEHAVIOR;The cause of the First so-called Harley Fires is still debat;"National Studies BISRA St Johns' College; Newspapers";;;In addtion to the Harley warehouse, six other houses were al;1;;;;;;;;;;100000;200000;;1;
Augustine;;;Mountain Pine Ridge and the Southern Coastal Plains;1999/11/1;About 70% or 21,000 hectares  of the pine forest in the Mountain Pine Ridge was destroyed by the Southern Bark Beetle, while another 50% or 95,000 hectares were loss to the Pine Beetle in the Southern Coastal Plains.;DROUGHT;The insect pest enjoyed favorable conditions due to the dens;Forest Dep Reports;;;As a direct loss, there were some 40 to 50% reduction in the;1;;;;;;;300;;;125000000;250000000;;;116000
Douglas;;;Douglas Village, Corozal District;2000/10/3;The torrential rainfall associated with Hurricane Keith generated copious ranfall especially over central and northern Belize.  This genrated rapid runoff and extensive flood in the Orange Walk, Corozal, Belize and Cayo Districts.;ATMOSPHCONDITION;The heavy showers began affecting Belize from the Septemebr ;NEMO Reports Newspaper Reports Met Reports and Bulletins, NHC Reports Red Cross Reports;;;Specific estimates of the losses suffered by the community o;1;;;;50;161;;787;;136;20250000;40500000;2;1;16187,4
San Jose OW;;;Mammiyal curve on the Northern Highway between Miles 58-59, ;2000/10/4;The effects of this tragic traffic accident were traumatic to the 40 passengers traveling in the bus, the conductor, the driver, the families of the three fatalities and the 36 injured Belizeans.  Also, the search and rescue team, comprising of soldiers of the Belize Defence Force, personnel from the Public Works Department, policemen and fire fighters were overwhelm by the incident, as well as the staff of the emergency ward of the Northern Regional Hospital in Orange Walk Town.;HUMANERROR;According to reports that have not been confirmed, the drive;Newspaper;;;When the Venus bus, carrying approximately 40 passengers hit;1;3;36;;;;;;;;15000;30000;;1;
San Pedro Town;;;San Pedro, Ambergris Caye and Caye Caulker;2000/9/29;"There are three elements to this disaster. Firstly, the excessive wind and storm surge, which caused extensive infrastructure damage mainly along the coast. Secondly, torrential rains and which substantially affected crops, livestock and physical infrastructure. In the third instance, the destruction of homes from both the direct onset of the Hurricane and the floods have caused
the displacement of thousands of persons, and it is anticipated that many of these persons, those dependent on subsistence and commercial farming, are facing at least two to four months of loss of livelihood and/or income.";ATMOSPHCONDITION;Hurricane Keith evolved from an area of disturbed weather th;NHC Report, Red Cross, NEMO Report, NMHS (Met), Newspaper;IV;;Widespread damage to buildings and infrastructure on both ca;1;5;;;;13000;3279;;;5000;261550000;523100000;60;3;8094
Dangriga Town;;;Stann Creek and Belize Districts;1978/9/18;"Areas highly impacted included the Stann Creek District, Dangriga Town, the Belize District and Belize City.  Losses were suffered in the Citrus Industry (US $10M); approximately 2,500 acres of Banana were flatten with estimated losses of US $5M;  another US $ 5M needed for recovery of Banana Industry; approximately 20% damage to Cocoa plantations; other damages to housing and infrastructure, giving a total of some US $25M for recovery.  Belizeans were grateful for the timely warning provided by the Weather Bureau, and expressed deep appreciation for a work well done by  Radio Belize and the the National Emergency Organization (NEO).";ATMOSPHCONDITION;Hurricane Greta strengthened in a manner very similar to Edi;NHC Report, NMHS Reports, GOB Report, Newspaper;III;;Significant losses were reported in the Banana and Citrus in;1;4;;3;;;;;;;12500000;25000000;;;1012
Corozal Town;;;Corozal Town;1955/9/28;By 10 p.m. 27th September 1955 winds of hurricane force were blowing in Corozal District and continued until about 1:30 a.m. on the 28th September when there was a dead calm until about 2 a.m.  Hurricane winds then blew again until about 4:30 a.m. when they gardualy subsided.  The center of Hurricane Janet had passed directly over Corozal Town.  There were no instruments in the Corozal District for measuring wind speeds, but it has been stated by an official of the Chetumal airport that the anemometer at Chetumal broke after recording a wind speed of 150 knots (i.e. 173 mph). This was the fiercest hurricane in the history of the country and was accompanied by torrential downpours and flooding in large parts on the Northern Districts.  There was little flooding from the sea except in Sarteneja where water is reported to have risen by eight (8) feet. Although there were only sixteen (16) casualties, some 20,000 persons were left in distress. Between 1,500 and 2,000 dwellings were destroyed in Corozal and adjoining districts.;ATMOSPHCONDITION;The first warning of Hurricane Janet was received on the 22n;Met Reports, NHC Reports, Newpapers, Publications, Jesuit Newletter, Colonial Report, Web Sources;IV;;Loss to the Agricultural Sector were estimated at Bz$2.8 mil;1;16;;;2000;2500;500;20000;;;200000000;400000000;26;2;182
;;;Belize City Municipal Airport, Belize District, Belize;2005/10/15;The single engine Cessna Caravan aircraft operated by Tropic Air Limited was being piloted by Mr. Issac Cabb, 36 years. His total flight time was 3144 hours.  Along with him in the aircraft were a total of thirteen (13) passengers. No injuries were reported and damges were minor.  The aircraft came to rest on the western taxiway just prior to the hold short line.  Most of the impact was concentrated on the left wing tip, i.e. apart from the Left Main Gear that fractured. No post crash fire noted.;DETERIORATION;The fractured Model 208B main landing gear spring (p/n 26410;Department of Civil Aviation;;;The aircraft sustained relatively minor damage as the impact;1;;;;;;;;;;;;;;
;;;The two-engine Islander Normandy (V3-HFO) aircraft operated ;2005/11/18;Gusty thermal winds in the hilly terrain onthe foothills of the Mountain Pine Ridge, together with low stratus cloud ceilings and inclement conditions generated by the proximity of tropical storm Gamma may have contributed to the fatal accident.;ATMOSPHCONDITION;It was concluded that at the time of the aircraft accident m;Civil Aviation Department Official Report;;;Three persons died during the accident. These included the p;1;3;;;;;;;;;1000000;2000000;;;
San Pedro Town;;;Sir Barry Bowen's Cessna aircraft went down on Ambergris Cay;2010/2/26;The caused of the Cessna 206 (V3HDR) aircraft accident in which Sir Barry Bowen perished, along with 4 passengers was attributed to lost of control of the aircraft by the pilot.;OTHER;A team of six investigators including two pilots, two mainte;Channel 5TV, Newspaper;;;;1;4;;;;;;;;;750000;1500000;;;
Monkey River;;;May 28, 2009 Earthquake impact at Monkey River, northern Tol;2009/5/28;The May 28, 2009 Earthquake, magnitude 7.1 ourred around 2:24 am and was felt across most of Belize. The village that got the greatest impact was Monkey River.  The effects were minor elsewhere.  A Tsunami Watch was issued by NEMO  for coastal Belize shortly after the Earthquake struck, but was lifted at 6:15 am, after the non occurrence of a Tsunami.;EARTHQUAKE;The May 28, 2009 Gulf of Honduras Earthquake originated alon;NEMO;7.1;;Elevated, 20,000 gallon ferro concrete water tank for at Ind;1;;;;1;15;1;93;;;30000;60000;;;
Duck Run;;;Duck Run 1, Cayo District;2010/10/24;The damages were mainly to homes and small buildings in that were poorly built. There were also minor damages to the local vegetation and backyard crops.  There were signs of serious damages to power lines and poles due to fallen trees and other debris, but all was repaired and power was re-stored in the days following the hurricane.;ATMOSPHCONDITION;Hurricane Richard, a Cat I hurricane with winds of 90 mph, m;DANA, Village Council;1;;;1;;;;3;1;14;4;;;8000;16000;;;
