Maya Mopan CY;;;Maya Mopan, City of Belmopan;2010/10/24;About 28 homes suffered wind and water damage during the passage of Hurricane Richard.;ATMOSPHCONDITION;Hurricane Richard made landfall in the Northern Lagoon area ;DANA, SIB;1;;There were significant wind damage to the vegetation in this;1;;;;;28;;140;;;48050;96100;;;
Duck Run;;;Duck Run 3, Cayo District;2010/10/24;There were signs of serious damages to power lines and poles due to fallen trees and other debris, but all was repaired and power was restored to the area a couple days following the hurricane.;ATMOSPHCONDITION;Hurricane Richard, a Cat I hurricane with winds of 90 mph, m;DANA, Village Council;1;;;1;;;;;3;;15;;;1600;3200;;;
Sarawee;;;Sarawee Village, Stann Creek District;2010/10/24;The strong winds associated with Hurricane Richard caused damages to homes and small buildings in poor conditions.;ATMOSPHCONDITION;Hurricane Richard, a Cat I hurricane with winds of 90 mph, m;Dana/Chairperson;1;;There were damages to crops and other fruit trees.;1;;;;;9;;45;;;;;;;
Salvapan;;;This is a village inside of Belmopan City.;2010/10/24;The damages were mainly to poorly constructed homes. There were also damages to the local vegetation and backyard fruit trees.;ATMOSPHCONDITION;Hurricane Richard made landfall in the Northern Lagoon area ;"DANA; Village Council";1;;Electricial appliances, personal apparel, and household furn;1;;;;;3;;15;;;8500;17000;;;
St. Paul's Bank;;;St. Paul's Bank, Belize District;2010/10/24;The damages were mainly to homes and small buildings in poor conditions. However, a few concrete homes were also affected.;ATMOSPHCONDITION;Hurricane Richard made landfall in the Northern Lagoon area ;DANA, NEMO Oct 25th, 2010;1;;Detectable damage to vegetation was experienced along the sw;1;;;;;7;3;33;;;;9318;;;
San Jose Succotz;;;San Jose Succotz, Cayo District;2010/10/24;Only one home suffered roofing damage. There were also minor damages to the local vegetation and backyard crops.;ATMOSPHCONDITION;Hurricane Richard made landfall in the Northern Lagoon area ;DANA, Village Council;1;;;1;;;;;1;;5;;;;;;;
Georgeville;;;Georgeville Village, Cayo District;2010/10/24;The damages were mainly to homes and poorly constructed buildings. There were also minor damages to the local vegetation and backyard crops.;ATMOSPHCONDITION;Hurricane Richard made landfall in the Northern Lagoon area ;DANA, Village Council;1;;Some household appliances received water damage and needed t;1;;;;1;16;4;80;;;;;;;
Valley Of Peace;;;Valley of Peace Village, Cayo District.;2010/10/24;There were damages to homes ranging from minor to severe. There were also  damage to local vegetation, backyard fruit trees and crops.;ATMOSPHCONDITION;Hurricane Richard made landfall in the Northern Lagoon area ;DANA Village Chairperson;1;;Electrical appliances, household furniture and personal appa;1;;;;;34;;177;;;;;;;
Belmopan;;;City of Belmopan (Capital of Belize), Cayo District;2010/10/24;The Mid-2008 population for Belmopan was 6,460. Losses were estimated at BZ$205,000 in the form of 13 damaged homes (65 victims) . Major damages to household appliances such as mattresses, stoves, computers etc., were documented in the Cohune Walk, New Site, Central Site, and Industrial Site only. Our Lady of Guadalupe RC Primary School received damage to the roof of their shed (BZ$8000). There were also major damages to local vegetation and backyard crops.;ATMOSPHCONDITION;Hurricane Richard made landfall in the Northern Lagoon area ;DANA, Min. of Education, SIB;1;;Undetermined loss of backyard crops, and trees.  The Western;1;;;;;13;65;6460;;;106500;213000;1;1;
San Martin;;;This is a village within the city of Belmopan.;2010/10/24;The strong winds associated with Hurricane Richard caused damages to small homes  in poor conditions. There were also damages to the local flora and backyard fruit trees.;ATMOSPHCONDITION;Hurricane Richard made landfall in the Northern Lagoon area ;"DANA; Village Council";1;;Electrical appliances, furniture and personal apparel were d;1;;;;2;15;10;75;;;39800;79600;;;
Hope Creek;;;Junction of the Hummingbird Highway and the Manatee Road.;2010/10/24;Poorly built wooden homes were damaged ranging from extensive to minimal. Electrical power lines and poles were blown down and portions of the roads were inaccessible as a result of fallen trees and localize flooding.;ATMOSPHCONDITION;Hurricane Richard, a Cat I hurricane with winds of 90 mph, m;DANA/Village Chairperson;1;;Citrus and other fruit trees were extensively damaged in the;1;;;;;32;;103;;;;;;;
Rancho Dolores;;;Rancho Dolores Village, Belize District;2010/10/25;The damages were mainly to small homes in poor conditions. Fallen trees  temporarily obstructed passage alone the major and minor roads.;ATMOSPHCONDITION;Hurricane Richard made landfall in the Northern Lagoon area ;DANA, NEMO Oct 25th, 2010;1;;There was also visible loss to livelihood including loss to ;1;;;;;5;;23;;;955;1910;;;
Santa Familia;;;Santa Familia Village, Cayo District;2010/10/24;The strong winds associated with Hurricane Richard caused damages to small  homes in poor conditions. There were also minor damages to the local vegetation and backyard fruit trees.;ATMOSPHCONDITION;Hurricane Richard made landfall in the Northern Lagoon area ;DANA Village Chairperson;1;;;1;;;;;8;;40;;;;;;;
San Carlos;;;San Carlos Village, Orange Walk District;2010/10/24;6 acres (2 hectares) of assorted vegetables  were partially destroyed. The direct economic loss in the agricultural sector is $18,000 (BZD).;ATMOSPHCONDITION;Hurricane Richard, a Cat I hurricane with winds of 90 mph, m;DANA;1;;;1;;;;;;;;;;9000;18000;;;2,4
Indian Creek OW;;;Indian Creek Village, Orange Walk District;2010/10/24;85 acres of papaya at the productive (harvesting) stage was completely destroyed in Indian Creek Village in the Orange Walk District. An additional 45 acres of papaya plantation at the vegetative stage was blown down. Partial damage is recorded to an additional 30 acres of plantation. The direct economic loss in this sector is estimated to be $5.08 million dollars (BZD).;ATMOSPHCONDITION;Hurricane Richard, a Cat I hurricane with winds of 90 mph, m;DANA;1;;;1;;;;;;;;;;2540000;5080000;;;64,75
Willows Bank;;;Willows Bank, Belize District;2010/10/24;The damages were mainly to homes and small buildings in poor conditions. There were also minor damages to the local vegetation and local crops.;ATMOSPHCONDITION;Hurricane Richard made landfall in the Northern Lagoon area ;DANA, NEMO Oct 25th, 2010;1;;Detectable damage to vegetation was experienced along the sw;1;;;;;5;;23;;;1035;2070;;;
Hattieville;;;Hattieville Village, Belize District;2010/10/24;The damages were mainly to homes and small buildings that were poorly constructed. There was also visible loss to livelihood including loss to agriculture and backyard crops (grapefruit and other citrus plants, banana, plantains, coconuts etc).;ATMOSPHCONDITION;Hurricane Richard made landfall in the Northern Lagoon area ;DANA 26 Oct, 2010, Hattieville Village Council;1;;Electrical and other household appliances were affected due ;1;;;;21;48;220;1758;;;35700;71400;;;
San Ignacio/Santa Elena;;;San Ignacio & Santa Elena town, Cayo district;2010/10/24;Tropical Storm force winds affected San Ignacio & Santa Elena from around 10:00 pm until 2:00  am on the night of October 24, 2010.;ATMOSPHCONDITION;;DANA Report;1;;;1;;;;;10;;;;;;23500;;;
Armenia;;;St. Herman's Blue Hole National Park, Armenia Village, Cayo ;2010/10/24;St. Herman's Blue Hole National Park covers 575 Acres or 232.7 Hecters of which 80% was estimated to be damaged. It is estimated that the park will not be accessible for several months and the forest will take some months to recover from the severe damage. The buildings and other facilities received minor damages.;ATMOSPHCONDITION;Hurricane Richard made landfall in the Northern Lagoon area ;DANA onsite assesment team Team2, BAS;1;;Damage to forest in this area was observed to be significant;1;;;;;;;;;;;;;;186
Gracie Rock;;;Gracie Rock, Belize District;2010/10/24;Many houses were damaged. Most of these houses had roof damage due to the effects of wind gusts.;ATMOSPHCONDITION;Hurricane Richard made landfall in the Northern Lagoon area ;DANA, NEMO;1;;S757,000 in homes;1;;;;5;22;5;99;;;378500;757000;;;
Gallon Jug;;;Gallon Jug Village, Orange Walk District;2010/10/24;There was damage to 100 acres of coffee plantation. The coffee industry suffered an estimated $384,000 (BZD) loss.;ATMOSPHCONDITION;Hurricane Richard, a Cat I hurricane with winds of 90 mph, m;DANA,;1;;;1;;;;;;;;;;192000;384000;;;40,47
Unitedville;;;From Belmopan, Unitedville Village is 12 miles west along th;2010/10/24;The village was noticeably affected and was receiving support from the Village Council. Detectable damage to vegetation was experienced along the swath of tropical storm force winds. Subsistence farms in this area also suffered significant wind damages.;ATMOSPHCONDITION;Hurricane Richard made landfall in the Northern Lagoon area ;"DANA; Village Council";1;;;1;;;;;3;;15;;;;;1;;
Camalote;;;Camalote Village is located approximately 3 miles from the C;2010/10/24;The damages were mainly to homes and small buildings in poor conditions. There were also minor damages to the local vegetation and backyard fruit tress crops such as citrus plants, plantains, coconuts, and cassava.;ATMOSPHCONDITION;Hurricane Richard made landfall in the Northern Lagoon area ;DANA/Village Chairperson;1;;Damage to one (1) 600 gallon Rotoplast water tank. The commu;1;;;;2;33;10;165;;;;;;;
Scotland Halfmoon;;;Scotland Halfmoon, Belize District;2010/10/24;Only One (1) wooden, abandoned and incomplete 20x20 house was completely destroyed. There were also minor damages to the local vegetation and local crops.;ATMOSPHCONDITION;Hurricane Richard made landfall in the Northern Lagoon area ;DANA, NEMO;1;;;1;;;;;;;;;;;;;;
More Tomorrow;;;More Tomorrow Village, Cayo District;2010/10/24;The damages were mainly to homes that were poorly built. There were also minor damages to the local vegetation and crops.;ATMOSPHCONDITION;Hurricane Richard made landfall in the Northern Lagoon area ;"DANA, NEMO, Oct-26-10;";1;;There were losses to livestock, particularly cattle and poul;1;;5;;2;18;10;90;;;6262,5;12525;;;
Teakettle;;;Teakettle Village, Cayo District;2010/10/24;The strong winds associated with Hurricane Richard caused damages to wooden homes in poor conditions. There were also damages to the local vegetation and backyard fruit trees. Fallen trees littered roads in this area, making transit difficult.;ATMOSPHCONDITION;Hurricane Richard made landfall in the Northern Lagoon area ;DANA, Village Council;1;;There was major damage to a fledgling Teak plantation with d;1;;;;;4;;20;;;;;;;
Esperanza CY;;;Esperanza Village, Cayo District;2010/10/24;The damages were mainly to homes and small buildings. There were also minor damages to the local vegetation.;ATMOSPHCONDITION;Hurricane Richard, a Cat I hurricane with winds of 90 mph, m;DANA 25/10/2010, Village Chairman;1;;Damage to backyard fruit trees.;1;;;;;2;;10;;;;;;;
Cotton Tree;;;Cotton Tree Village, Cayo District;2010/10/24;The damages were mainly to homes and small buildings in poor conditions. The building that serves as the Cotton Tree RC School suffered damage to its roof. Several residents experienced significant losses to agricultural crops, fruit trees, poultry, and livestock. It was observed that the water supply for the village was contaminated.;ATMOSPHCONDITION;Hurricane Richard made landfall in the Northern Lagoon area ;DANA, Village Council Report;1;;Electrical and other household appliances were affected due ;1;;;;7;123;35;615;;;75000;150000;1;1;
Armenia;;;Armenia Village, Cayo District;2010/10/24;The damages were mainly to homes and small buildings in poor conditions. There was also visible loss to livelihood including loss to agriculture and backyard crops (grapefruit and other citrus plants, banana, plantains, coconuts etc).;ATMOSPHCONDITION;Hurricane Richard made landfall in the Northern Lagoon area ;DANA, Village Chairmain Mr. Orestes Sho;1;;Detectable damage to vegetation was experienced along the sw;1;;;;1;11;189;500;;189;;;;;3
Lemonal;;;Lemonal Village, Belize District;2010/10/24;The damages were mainly to homes and small buildings in poor conditions. There was also visible loss to livelihood including loss to agriculture, local vegetation and backyard crops (grapefruit and other citrus plants, banana, plantains, coconuts etc). Fences, including barbed wire enclosures were also damaged.;ATMOSPHCONDITION;Hurricane Richard made landfall in the Northern Lagoon area ;DANA Reports, Village Council Reports;1;;;1;;;;;5;;17;;;;;;;
Spanish Lookout;;;Spanish Lookout, Cayo District, Belize;2010/10/24;There were signs of serious damages to power lines and poles due to fallen trees and other debris, but all had already been repaired and power stored.;ATMOSPHCONDITION;Hurricane Richard, a Cat I hurricane with winds of 90 mph, m;"DANA, NEMO 27-oct-10; MAFC; NHC Bulletins, Met Reports";1;;Power lines were down and traffic disrupted at the low-lying;1;;;;;6;;24;;;68300;136600;1;1;
Blackman Eddy;;;Blackman Eddy Village, Cayo District;2010/10/24;Damaged homes were also visible among the elderly and vulnerable populations. There were also discernible  damage to the cemetery and a church as a result of fallen trees.;ATMOSPHCONDITION;Hurricane Richard made landfall in the Northern Lagoon area ;DANA Report 2010-10-25, Village Chairman;1;;Electrical and other household appliances were affected due ;1;;;;;12;60;543;;;;;;;
Frank's Eddy;;;Frank's Eddy Village, Cayo District;2010/10/24;The damages were mainly to substandard homes in poor conditions. There were also minor damages to the local flora, backyard fruit trees and crops.;ATMOSPHCONDITION;Hurricane Richard made landfall in the Northern Lagoon area ;DANA, NEMO Oct 25th, 2010;1;;Appliances and other household furnitures were destroyed due;1;;;;2;21;10;105;;;18350;36700;;;
;;;Orange Walk District;2010/10/24;85 acres of papaya at the productive (harvesting) stage was completely destroyed in Indian Creek Village in the Orange Walk District. An additional 45 acres of papaya plantation at the vegetative stage was also destroyed. Partial damage is recorded to an additional 30 acres of plantation. The direct economic loss in this sector is estimated to be $5.08 million dollars (BZD) loss. There was also damage to 100 acres of coffee plantation in Gallon Jug. The coffee industry suffered an estimated $384,000 (BZD) loss. Lastly, 6 acres of assorted vegetables were partially destroyed. The direct economic loss in this sector is $18,000 (BZD).;ATMOSPHCONDITION;Hurricane Richard, a Cat I hurricane with winds of 90 mph, m;NEMO, Red Cross, Met;1;;Other agricultural crops such as sugarcane and rice also suf;1;;;;53;180;265;900;;;2600000;5200000;;;107,65
;;;Belize City;1961/10/27;"Hurricane Hattie, the 8th tropical cyclone of the 1961 North Atlantic Huricane Season destroyed most of the old capital city of Belize, formerly British Honduras, as well as the town of Stann Creek, now called Dangriga.[2] The hurricane left significant crop damage across the region, including $2 million in citrus fruits and similar losses to timber, cocoa, and bananas. Damage throughout the territory totaled $60 million (1961 USD, $435 million 2009 USD),[2] and a total of 307 deaths were reported;[11] more than a 100 fatalities were in Belize City.[10] The government of British Honduras considered Hurricane Hattie more damaging than a hurricane in 1931 which killed 2,000 people; the lower death toll of Hattie was due to advanced warning.[2]";ATMOSPHCONDITION;The first indication of the existence of Hattie came from a ;Met, NHC, Jesuit Mission;4;;"Major losses to the citrus and timber industries; also losse";1;307;200;;2480;1860;;31000;;;30000000;60000000;10;6;2000000
Flowers Bank;;;Flowers Bank, Belize River Valley, Belize District;2010/10/24;Tropical Storm force winds appeared to have been weaker in the northern Belize River Valley. At Flowers Bank, only one house was affected as a result of wind damage.;ATMOSPHCONDITION;Hurricane Richard made landfall in the Northern Lagoon area ;DANA, Village Chairman;1;;Other losses included damage to some crops and vegetation/fo;1;;;;;1;;;;;;;;1;
